type	caption	answer	add_caption	c1_variable	c1_comp	c1_condition	c2_variable	c2_comp	c2_condition	c3_variable	c3_comp	c3_condition
	Lord Bridwell	Lord Bridwell's the man if you need a true knight. He keeps Daggerfall safe and sound.|Lord Bridwell is a man who knows war. He led our men like a hero in the War of Betony, they say.|Lord Bridwell commands the Knights of the Dragon. He's Daggerfall's strong right arm in war and peace.	the Knights of the Dragon|the War of Betony|the Knights of the Dragon	Current Region Name	==	Daggerfall	Faction Social Group	==	1|4			
	Lord Bridwell	Lord Bridwell, as the leader of the Knights of the Dragon, not only exemplifies chivalric virtues but also plays a critical role in maintaining security and order within the kingdom of Daggerfall.|Lord Bridwell is celebrated for his valor during the War of Betony, where he commanded the naval forces at the Battle of the Bluffs and played a critical role in lifting the Siege of Craghold.|Lord Bridwell is the commander of Daggerfall's Knights of the Dragon, the knightly order dedicated to the protection of the kingdom and the royal family.	the Knights of the Dragon|the War of Betony|the Knights of the Dragon	Current Region Name	==	Daggerfall						
	Lord Bridwell	You should ask about the big lords in the big city.|We don't see anyone from the court around these parts.|I've never met him.		Current Region Name	==	Daggerfall						
	The Knights of the Dragon	The Knights of the Dragon serve me and my kingdom. My right-hand man Lord Bridwell commands them.	Lord Bridwell	NPC Name	==	King Gothryd	NPC NoLore	==	3			
	the Knights of the Dragon	The Knights of the Dragon are Daggerfall's pride. Fierce in a fight and loyal to the bone.|The Knights of the Dragon love to show off their skills. You should see them at the tournaments, all flash and dazzle.|Lord Bridwell commands the Knights of the Dragon. He's a living legend, especially after the War of Betony scuffle.	-|-|Lord Bridwell,the War of Betony	Current Region Name	==	Daggerfall	Faction Social Group	==	1|4			
	the Knights of the Dragon	The Knights of the Dragon is composed of the finest knights of the Daggerfall militia, bound together by vows of service to the royal family and kingdom.|The Knights of the Dragon often participate in tournaments to hone their skills. Their prowess in jousting and melee draws crowds during Daggerfall's festivals.|The Knights of the Dragon are commanded by Lord Bridwell, a man justly celebrated for his valor during the War of Betony.	-|-|Lord Bridwell,the War of Betony	Current Region Name	==	Daggerfall						
	the War of Betony	It was a necessary fight against a dishonorable land grab by Sentinel. But that's all in the past now. There are much bigger things in store for Daggerfall than petty disputes over islands.	Sentinel	NPC Name	==	King Gothryd	NPC NoLore	==	3			
	the War of Betony	The War of Betony was us against Sentinel over a speck of land. King Lysandus didn't want to let any harm come to Betony's folk.|The War of Betony, that was our stand against Sentinel's greedy land grab. King Lysandus was only looking out for the little guys.|The War of Betony will go down as the time Daggerfall stood tall and didn't let a big bully push us around.|Daggerfall showed Sentinel who truly owns the Iliac Bay at the Battle of Cryngaine Field.	King Lysandus,Sentinel|Sentinel,King Lysandus|-|the Battle of Cryngaine Field	Current Region Name	==	Daggerfall	Faction Social Group	==	1|4			
	the War of Betony	The War of Betony was a test of Daggerfall's mettle, with King Lysandus leading our forces to protect the Isle of Betony from Sentinel's avarice. Our city's honor demanded it.|The War of Betony was a necessary defense of our rights and territories against Sentinel's grasping ambition. Our King Lysandus acted only to protect the innocents of Betony from piracy and neglect.|Our history books will tell of the War of Betony as a time when Daggerfall stood firm against aggression, defending a smaller ally from a larger foe's greed.|The War of Betony ended at the Battle of Cryngaine Field with Daggerfall's complete victory over Sentinel.	King Lysandus,Sentinel|Sentinel,King Lysandus|-|the Battle of Cryngaine Field	Current Region Name	==	Daggerfall						
	the Battle of Cryngaine Field	Why, that's where I covered myself with glory, isn't it, my dear Queen Aubk-i?	Queen Aubk-i	NPC Name	==	King Gothryd	NPC NoLore	==	3			
	the Battle of Cryngaine Field	The Battle of Cryngaine Field, what a mess that was. There was fog so thick you could carve it. Then King Lysandus went down, Prince Gothryd stepped up, and Daggerfall won.|King Lysandus's death at Cryngaine was bad news. But Gothryd, he just grabbed the crown and the victory.|Cryngaine's where we settled things with Sentinel in that Betony mess.|Sentinel had to eat crow when Gothryd took down Camaron at Cryngaine Field.|I fought in Cryngaine myself. Not a natural fog, that. And poor King Lysandus, dead with an arrow to the throat.	King Lysandus,King Gothryd,Sentinel|King Lysandus,King Gothryd|the War of Betony|Sentinel,King Gothryd|King Lysandus	Current MapID	==	1291010263	Faction Social Group	==	1|4			
	the Battle of Cryngaine Field	The War of Betony ended with the Battle of Cryngaine Field. An eerie fog covered the battlefield, King Lysandus was slain, then Prince Gothryd was crowned and killed King Camaron of Sentinel in single combat.|King Lysandus' death during the Battle of Cryngaine Field was a dark hour for Daggerfall, yet our soldiers rallied behind Prince Gothryd.|Cryngaine field is the place where two kings died, where another was crowned, and where the War of Betony was won. Glory to Daggerfall!|Sentinel was forced to accept a humiliating peace after King Gothryd slew Camaron of Sentinel in the Battle of Cryngaine field.|I fought at the Battle of Cryngaine Field. The fog that covered that battlefield was not natural, I say. We saw strange shapes and sounds in the mist, and when it lifted, King Lysandus lay dead with an arrow in his throat.	King Lysandus,King Gothryd,Sentinel|King Lysandus,King Gothryd|the War of Betony|Sentinel,King Gothryd|King Lysandus	Current MapID	==	1291010263						
	the Day of the Dead	Day of the Dead's a bit eerie, innit? Ghosts settling scores and all that.|Kynareth's priests work overtime on the Day of the Dead, making nice with the spirits.|Ol' King Lysandus started his haunting on the Day of the Dead.	-|Kynareth|King Lysandus	Current Region Name	==	Daggerfall	Faction Social Group	==	1|4			
	the Day of the Dead	The Day of the Dead is when Daggerfall honors those passed. It's said the dead rise to seek vengeance, though many just use the day to remember lost loved ones.|Kynareth's priests in Daggerfall offer blessings and perform rites to appease the spirits on the Day of the Dead, ensuring peace between the living and the dead for another year.|King Lysandus' spirit began its haunting precisely on the 13th of Rain's Hand -- the Day of the Dead.	-|Kynareth|King Lysandus	Current Region Name	==	Daggerfall						
	Wayrest	The Kingdom of Wayrest has grown wealthy but indolent under fat old Eadwyre. Perhaps the time has come for a younger, hungrier generation to take the reins of leadership there.		NPC Name	==	King Gothryd	NPC NoLore	==	3			
	Wayrest	Wayrest's streets might be lined with gold, but Daggerfall's the real heart of Breton chivalry.|King Eadwyre sits on Wayrest's throne and rakes in all those riches from the Bjoulsae River trade.|I hear all of Wayrest is under the spell of the Dark Elf queen, Barenziah, and her brood.	Breton|-|-|-|-	Current Region Name	==	Daggerfall	Faction Social Group	==	1|4			
	Wayrest	Wayrest's streets might be lined with gold, but it's Daggerfall where the true heart of Breton strength and chivalry beats strongest.|Wayrest is ruled by King Eadwyre. The kingdom has grown wealthy and influential under his reign, thanks to its location at the mouth of the Bjoulsae River.|Wayrest is famous for its grand architecture, including the lavish palace where King Eadwyre and his Dark Elf Queen Barenziah reside.|We in Daggerfall often view Wayrest as our chief competitor. Our kingdoms vie for control over trade routes and influence in the Bay.|Daggerfall and Wayrest often act like squabbling siblings, each trying to outdo the other in wealth, military power, and influence across the Iliac Bay.	Breton|-|-|-|-	Current Region Name	==	Daggerfall						
	Sentinel	Sentinel’s glory days are long behind her now. Her people are no longer the warriors they once were. My father may have been blind to much in politics but he saw that.		NPC Name	==	King Gothryd	NPC NoLore	==	3			
	Sentinel	Sentinel's no stranger to throwing its weight around. They do politics with a sword in hand there.|Sentinel is all desert and warriors. They're a tough lot, no doubt about it.|You hear stories about Queen Akorithi from Sentinel. Gives you shivers, the things they say.|There's peace with Sentinel now, sure, but nobody's forgotten the War of Betony.	-|-|-|the War of Betony	Current Region Name	==	Daggerfall	Faction Social Group	==	1|4			
	Sentinel	Sentinel plays regional politics with a straight hand. Direct, aggressive, it's a stark contrast to Daggerfall's more nuanced strategies.|Sentinel is a Redguard kingdom in northern Hammerfell, known for its vast deserts and fierce warrior culture.|Sentinel's Queen Akorithi has a frightening reputation. King Gothryd is lucky he only had to fight her husband at the Battle of Cryngaine.|Daggerfall and Sentinel now maintain a cautious peace, but none of us have forgotten the War of Betony.	-|-|King Gothryd,Battle of Cryngaine|the War of Betony	Current Region Name	==	Daggerfall						
	Sentinel	Sentinel's wedged between the desert and the water, making it a prime spot for trade from both land and sea.|Queen Akorithi's been in charge since her husband bit the dust in the Siege of Betony. She's keeping things together, but just barely.|Sentinel's a great trade hub, connecting the Alik'r caravan routes with the sea trades that pass through the Iliac Bay.|Our local artisans are top-notch, making textiles and pottery that's shipped all over Tamriel.|Sentinel used to be the land of sword-singers. Now it's filled with traders and hagglers. The Siege of Betony was a wakeup call.|We're all merchants here now, not the warriors we once were. That's probably why the Siege of Betony went the way it did.|We used to be warriors, now we're just traders. Maybe that's why we couldn't stand our ground at the Siege of Betony.|Arkay's our patron god here in Sentinel. He helps folks deal with life, death, and everything in between.|We worship Arkay here in Sentinel. He ties us to our past and to our ancestors. Through Him they still guide us with the traditions they carried from old Yokuda.|Honoring Arkay, the patron god of Sentinel, helps us keep in touch with our ancestors.|The Order of the Candle is Sentinel's new knightly order. It's patched together from the few who didn't fall during the Siege of Betony.|After the Siege of Betony, the surviving knights and some fresh faces banded together, calling themselves the Order of the Candle. They're trying to hold onto what honor's left.|It's tough farming on these windswept coastal plains, so Sentinel looks to the seas for its wealth.|Sentinel is perfect if you enjoy dodging camels and merchants from dawn till dusk.|Sentinel is renowned for its hospitality, provided you're not from Daggerfall.|Sentinel's warriors of old must be rolling in their graves to see their descendants trading princesses instead of blows.|Sentinel is governed by Queen Regent Akorithi and her princes Greklith and Lhotun.|Sentinel is a bustling trade city overlooking the Iliac Bay. The markets run from the harbor all the way to the gates of the badlands.|The oldest structure here is the Samaruik, or Sentinel Palace. It started as a fortress during the Redguard migration from Yokuda, but has grown into an opulent royal estate.|The streets of Sentinel are a hub for traders. The markets are good for those looking to make or spend some gold.|Travelers with a little gold to spend are always welcome in Sentinel's bazaars... but watch your purse.	-|Queen Akorithi,the Siege of Betony|Alik'r Desert|-|sword-singing,the Siege of Betony|the Siege of Betony|the Siege of Betony|Arkay|Arkay,Yokuda|Arkay|the Order of the Candle,the Siege of Betony|the Order of the Candle,the Siege of Betony|-|-|Daggerfall|-|Queen Akorithi,Prince Greklith,Prince Lhotun|-|Samaruik,Redguards,Yokuda|-|-	Current MapID	==	6634853	Faction Social Group	==	1|4			
	Sentinel	Sentinel is surrounded by hills and windswept plains that stretch back to the Alik'r Desert. It's a strategic spot for trade, given its location between the desert and the sea.|Queen Akorithi rules over Sentinel now. She took over after her husband died in the Siege of Betony and has kept the kingdom from collapsing after that humiliation.|Sentinel is ruled by Queen Akorithi, who, like any good monarch, shows her love for the people by staying far away from them.|Sentinel thrives as a trading hub. We owe our prosperity not just to the caravans that brave the Alik'r, but also to the maritime commerce of the Iliac Bay.|The craftsmanship of Sentinel's artisans, who work in textiles and ceramics, is celebrated across Tamriel.|Ah, Sentinel, a once-great Redguard kingdom where the clang of swords has given way to the clink of coins. We'd never have lost the Siege of Betony if we'd kept our warrior ways.|Sentinel has become a haven for merchants, a far cry from our warrior past. It's made us rich but cost us dearly in the Siege of Betony.|Sentinel is a kingdom of merchants descended from a nation of warriors. No wonder we failed to lift the Siege of Betony.|Sentinel is deeply devoted to Arkay, the god of life and death. His temples offer solace to those grieving and guidance on spiritual matters.|Arkay's influence is strong in Sentinel, guiding our traditions around birth, death, and rebirth.|The worship of Arkay in Sentinel is bound up with our reverence for our ancestors. We believe their spirits guide us with ancient wisdom rooted in the traditions they preserved from Yokuda to Hammerfell.|Through the worship of Arkay, we connect with our Yokudan ancestors. Their journey's end gave rise to our new beginnings here in Hammerfell.|Sentinel is protected by the Order of the Candle, the knightly order formed to replace the Knights of the Moon after their defeat in the Siege of Betony.|Many of Sentinel's bravest warriors were killed in the Siege of Betony. Those who survived the war formed the Order of the Candle to restore our kingdom's honor.|Sentinel is a bustling trade city overlooking the Iliac Bay. The markets run from the harbor all the way to the gates of the badlands.|The oldest structure here is the Samaruik, or Sentinel Palace. It started as a fortress during the Redguard migration from Yokuda, but has grown into an opulent royal estate.|The streets of Sentinel are a hub for traders. The markets are good for those looking to make or spend some gold.|Travelers with a little gold to spend are always welcome in Sentinel's bazaars... but watch your purse.	Alik'r Desert|Queen Akorithi,the Siege of Betony|Queen Akorithi|Alik'r Desert|-|Redguards,the Siege of Betony|the Siege of Betony|Siege of Betony|Arkay|Arkay,Yokuda,Hammerfell|Arkay,Yokuda,Hammerfell|the Order of the Candle,the Siege of Betony|the Order of the Candle,the Siege of Betony|-|Samaruik,Redguards,Yokuda|-|-	Current MapID	==	6634853						
	Sentinel	Sentinel's wedged between the desert and the water, making it a prime spot for trade from both land and sea.|Queen Akorithi's been in charge since her husband bit the dust in the Siege of Betony. She's keeping things together, but just barely.|Sentinel's a great trade hub, connecting the Alik'r caravan routes with the sea trades that pass through the Iliac Bay.|Our local artisans are top-notch, making textiles and pottery that's shipped all over Tamriel.|Sentinel used to be the land of sword-singers. Now it's filled with traders and hagglers. The Siege of Betony was a wakeup call.|We're all merchants here now, not the warriors we once were. That's probably why the Siege of Betony went the way it did.|We used to be warriors, now we're just traders. Maybe that's why we couldn't stand our ground at the Siege of Betony.|Arkay's our patron god here in Sentinel. He helps folks deal with life, death, and everything in between.|We worship Arkay here in Sentinel. He ties us to our past and to our ancestors. Through Him they still guide us with the traditions they carried from old Yokuda.|Honoring Arkay, the patron god of Sentinel, helps us keep in touch with our ancestors.|The Order of the Candle is Sentinel's new knightly order. It's patched together from the few who didn't fall during the Siege of Betony.|After the Siege of Betony, the surviving knights and some fresh faces banded together, calling themselves the Order of the Candle. They're trying to hold onto what honor's left.|It's tough farming on these windswept coastal plains, so Sentinel looks to the seas for its wealth.|Sentinel is perfect if you enjoy dodging camels and merchants from dawn till dusk.|Sentinel is renowned for its hospitality, provided you're not from Daggerfall.|Sentinel's warriors of old must be rolling in their graves to see their descendants trading princesses instead of blows.|Sentinel is governed by Queen Regent Akorithi and her princes Greklith and Lhotun.	-|Queen Akorithi,the Siege of Betony|Alik'r Desert|-|sword-singing,the Siege of Betony|the Siege of Betony|the Siege of Betony|Arkay|Arkay,Yokuda|Arkay|the Order of the Candle,the Siege of Betony|the Order of the Candle,the Siege of Betony|-|-|Daggerfall|-|Queen Akorithi,Prince Greklith,Prince Lhotun	Current Region Name	==	Sentinel	Faction Social Group	==	1|4			
	Sentinel	Sentinel is surrounded by hills and windswept plains that stretch back to the Alik'r Desert. It's a strategic spot for trade, given its location between the desert and the sea.|Queen Akorithi rules over Sentinel now. She took over after her husband died in the Siege of Betony and has kept the kingdom from collapsing after that humiliation.|Sentinel is ruled by Queen Akorithi, who, like any good monarch, shows her love for the people by staying far away from them.|Sentinel thrives as a trading hub. We owe our prosperity not just to the caravans that brave the Alik'r, but also to the maritime commerce of the Iliac Bay.|The craftsmanship of Sentinel's artisans, who work in textiles and ceramics, is celebrated across Tamriel.|Ah, Sentinel, a once-great Redguard kingdom where the clang of swords has given way to the clink of coins. We'd never have lost the Siege of Betony if we'd kept our warrior ways.|Sentinel has become a haven for merchants, a far cry from our warrior past. It's made us rich but cost us dearly in the Siege of Betony.|Sentinel is a kingdom of merchants descended from a nation of warriors. No wonder we failed to lift the Siege of Betony.|Sentinel is deeply devoted to Arkay, the god of life and death. His temples offer solace to those grieving and guidance on spiritual matters.|Arkay's influence is strong in Sentinel, guiding our traditions around birth, death, and rebirth.|The worship of Arkay in Sentinel is bound up with our reverence for our ancestors. We believe their spirits guide us with ancient wisdom rooted in the traditions they preserved from Yokuda to Hammerfell.|Through the worship of Arkay, we connect with our Yokudan ancestors. Their journey's end gave rise to our new beginnings here in Hammerfell.|Sentinel is protected by the Order of the Candle, the knightly order formed to replace the Knights of the Moon after their defeat in the Siege of Betony.|Many of Sentinel's bravest warriors were killed in the Siege of Betony. Those who survived the war formed the Order of the Candle to restore our kingdom's honor.	Alik'r Desert|Queen Akorithi,the Siege of Betony|Queen Akorithi|Alik'r Desert|-|Redguards,the Siege of Betony|the Siege of Betony|Siege of Betony|Arkay|Arkay,Yokuda,Hammerfell|Arkay,Yokuda,Hammerfell|the Order of the Candle,the Siege of Betony|the Order of the Candle,the Siege of Betony	Current Region Name	==	Sentinel						
	Queen Akorithi	Queen Akorithi's smiles are as common as rain in the Alik'r.|Our beloved Queen Akorithi sent her only daughter to marry her husband's killer. Redguard merchants are more sentimental about their camels.|Our Queen Akorithi takes a pragmatic, sometimes ruthless approach to governance. She views unflinching strength as necessary for the good of the kingdom.|Akorithi became Queen Regent after her husband King Camaron's death in the Siege of Betony.|Queen Akorithi had four children with the late King Camaron. Prince Greklith, Prince Lhotun, Princess Aubk-i, and another, Prince Arthago, who died young.|Queen Akorithi views her heirs like chess pieces. Prince Greklith is her king in waiting, Prince Lhotun, perhaps a bishop at best, and Princess Aubk-i, nothing but a pawn sacrificed to advance her position.	Alik'r Desert|Redguards|-|King Camaron,the Siege of Betony|King Camaron,Prince Greklith,Prince Lhotun,Princess Aubk-i,Prince Arthago|Prince Greklith,Prince Lhotun,Princess Aubk-i	Current MapID	==	6634853						
	Queen Akorithi	Hail Her Majesty, Queen Akorithi!|Our Queen Akorithi is a tough woman, seeing Sentinel through tough times.|Are you planning to go see the Queen? Really, now?		Current Region Name	==	Sentinel						
	King Camaron	King Camaron's enthusiasm for war was only matched by his lack of success at it.|Camaron was a king of the old mold, who believed in strength and sword. But today Sentinel is a kingdom of merchants, not warriors.|Daggerfall's bards would have it that Gothryd of Daggerfall overcame King Camaron in glorious combat. But we know it was black magic and treachery that gave him the upper hand.|King Camaron's reign was a series of strategic blunders dressed up as military campaigns.|King Camaron ignored The Oracle's warnings that the Siege of Betony would end in debacle and death.	-|-|Daggerfall|-|The Oracle,the Siege of Betony	Current MapID	==	6634853						
	Prince Greklith	Prince Greklith, our future king, is every inch the warrior his father was.|Greklith means 'strong king' in the old tongue. What we need is a little wisdom, though.|Greklith is Sentinel's crown prince. He's certainly got the look of a king, but who knows if he's got the wits for kingship.|Prince Greklith cuts a fine figure, but a king needs judgment and compassion as well.		Current MapID	==	6634853						
	Prince Lhotun	Prince Lhotun often seems more thoughtful than the other royals.|Lhotun is youngest prince, with a mind for the people and a heart too tender for the throne. |Prince Lhotun is more a poet than a soldier, they say. Hardly the making of a ruler in a mighty Redguard kingdom. |Prince Lhotun is as likely to be found brooding alone as addressing his duties.	-|-|Redguards|-	Current MapID	==	6634853						
	Princess Aubk-i	We all know the tale of Princess Aubk-i. Sacrificed for a shameful peace, wed to a king whose hands still bear her father's blood.|Princess Aubk-i was her father's jewel, his favored child, and now married to Gothryd of Daggerfall, her father's killer.|Princess Aubk-i is a prisoner of war, taken when we lost the Siege of Betony.	-|Daggerfall|the Siege of Betony	Current MapID	==	6634853						
	Prince Arthago	He was a feeble lad, even more bookish than Prince Lhotun. Carried off by a plague, as I recall.|I once heard that Prince Arthago, weary of royal burdens and his family's disdain, faked his own death to run off and live a quiet life among common folk.|Prince Arthago was the Scholar Prince, always buried in his books rather than preparing for kingship. Fell ill with a fever and we never heard of him again. |I hear Prince Arthago was a cripple and a hunchback. Some say he lives yet and the king and queen have him locked away in a dungeon somewhere.|Kidnapped by the Underking, that boy was.|Prince Arthago was always too weak and sickly to be much loved by the king and queen. They didn't even hold a royal funeral when he passed.	Prince Lhotun|-|-|-|the Underking|-	Current MapID	==	6634853						
	the Order of the Candle	The Order of the Candle is the knightly order charged with the protection of the royal family and kingdom of Sentinel.|The Order of the Candle is a new knightly order, formed after the Knights of the Moon disgraced themselves in the Siege of Betony. |Many of these new so-called knights in the Order of the Candle came the personal retinues of Lord Vhosek and Lord K'avar.|The Order of the Candle is led by Lord Vhosek and Lord K'avar. They are more warlords than knights, if you ask me.|The knights of the Order of the Candle are everywhere in Sentinel, but some of them look barely old enough to shave.|After the old guard was killed off in the Siege of Betony, it feels like they're letting just about anyone who can swing a sword into the Order of the Candle.|It's Sentinel's new knightly order. Some of them are still learning on the job.|The Order of the Candle is the knightly order that supposedly protect Sentinel, but let's just say they've had to dip into the reserves a bit too much of late.	-|the Siege of Betony|Lord K'avar|Lord K'avar|-|the Siege of Betony|-|-	Current MapID	==	6634853						
