type	caption	answer	add_caption	c1_variable	c1_comp	c1_condition	c2_variable	c2_comp	c2_condition	c3_variable	c3_comp	c3_condition
	Lainlyn	Lainlyn's wedged right up against the Dragontail Mountains, covered in thick rainforests. Tough land, but it makes us tough people.| Baron Shrike rules Lainlyn like he owns every blade of grass and every tree. His word is law here, and his knights make sure we don't forget it.| We follow Julianos here, the god of wisdom and logic.| Trade's our lifeline, but Baron Shrike's taxes strangle it. He's filling his coffers while we scrape by.| Rainforest and rocky hills, that's Lainlyn. Farming is a gamble and traveling is dangerous.| There's little peace in Lainlyn. People look over their shoulders, and even families don't trust each other fully.|Lainlyn thrives under the stern and watchful eye of our great Baron Shrike. His firm rule ensures that order prevails in every corner of our barony. Who could ask for a better leader?| The Host of the Horn, our noble protectors, are the strong arm of justice here in Lainlyn. We sleep peacefully knowing they are ever-watchful, ever-present.| Why, it's been a golden era here in Lainlyn! Each day is better than the last, as long as you follow the rules, pay your taxes, and keep your head down.	-| Baron Shrike|Julianos|Baron Shrike|-|-|Baron Shrike|the Host of the Horn|-	Current Region Name	==	Lainlyn						
	Baron Shrike	Baron Shrike's leadership is a true blessing! His constant vigilance keeps us all in line, safe from any missteps we might foolishly consider.| It might be foolish of Lord Kain to challenge his brother—but it shows Baron Shrike's fairness in allowing such... disagreements. It truly demonstrates his magnanimity, doesn't it?| Praise be to Julianos for giving us Baron Shrike, whose wisdom surely rivals that of our divine patron! Surely, the god of wisdom himself consults our Baron on matters of justice.|It is truly shameful that our Baron's just rule has been challenged by his soft-hearted and soft-minded brother, Lord Kain. Kain says the Baron should stop crucifying criminals, vagrants, debtors, and other idle loafers. Such folly!|Baron Shrike levied a corvée last year to build an opulent villa for his wife, the Baroness Dh'emka. Such a romantic, don't you think?|The Baron's justice is legendary. A merchant once accused of shortchanging the royal taxes was made to count every coin in the treasury as a lesson in accuracy, under the watchful eyes of the Host of the Horn, day and night, until he collapsed.|Even the families of those suspected of aiding the Host of the True Horn are crucified. “Treason is a seed that grows on tainted soil,” our Baron says.	-| Lord Kain|Julianos|Lord Kain|Baroness Dh'emka|the Host of the Horn|the Host of the True Horn	Current Region Name	==	Lainlyn						
	Baroness Dh'emka	Baroness Dh'emka, wife to Baron Shrike, is known for her exquisite taste. The halls of Lainlyn's castle are draped in the finest silks and adorned with rare artifacts.| While the Baroness enjoys the finest luxuries money can buy, her servants tread lightly around her, as her favor is as fleeting as her temper.| It is said that Baroness Dh'emka once ordered a sculptor to recreate a famous statue she fancied. Unpleased with the result, she had the sculptor's hands broken, claiming they were unfit for the art she desired. She is as wise and just as her husband the Baron.|Once, a maid accidentally spilled wine on a tapestry imported from distant lands. The Baroness had her confined to the dungeons until she perished – a lesson in precision for all her staff. 		Current Region Name	==	Lainlyn						
	Lord Kain	I did not mean to mention him. Did I mention him?|Um, a wretched villain. A criminal like the rest of that sorry lot, the Host of the True Horn.|Lord Kain is Baron Shrike's brother. He has launched a rebellion, gathering to him men and women who believe that Lainlyn should be governed with less… severity.|Lord Kain's got his own group, the Host of the True Horn. Thinks he can run Lainlyn better than his brother.|Lord Kain? Never heard of him. Don't ask again.	-|the Host of the True Horn|Baron Shrike|the Host of the True Horn|	Current Region Name	==	Lainlyn						
	the Host of the Horn	The Host of the Horn, that's our baron's personal army. They're everywhere—collecting taxes, keeping order. Not the sort you'd want to cross.|The Host of the Horn are composed of the finest knights of Lainlyn, bound by oaths to protect and serve the Barony of Lainlyn and its ruling family.|The Host of the Horn carries out the Baron's justice. You know, executions, cutting off hands, and so on.		Current Region Name	==	Lainlyn						
	the Host of the True Horn	They're nothing but troublemakers and rebels. They're against Baron Shrike's rule. Can't say much more in the open, you understand.|The Host of the True Horn are officially traitors, so I say they're traitors. Don't you?|To speak openly of them is to invite danger. It's better discussed away from prying ears.| The Host of the True Horn? If they exist, they'd be planning to unseat the Baron, or so the rumors go.	Baron Shrike|-|	Current Region Name	==	Lainlyn						
	Daggerfall	Is she not magnificent? Daggerfall is heir to thousands of years of Breton chivalry. We do not elevate vulgar newcomers into the nobility like Wayrest, nor make lesser races our equals like the decaying Empire.	Wayrest,Empire	NPC Name	==	King Gothryd	NPC NoLore	==	3			
	Daggerfall	Daggerfall's the crown jewel of the Iliac Bay, best in knightly valor and throwing down in a scrap if need be.|Daggerfall's knightly order, the Knights of the Dragon, are a tough lot. They're always ready to keep the peace or throw a punch if things get dicey.|Wayrest may control the Bjoulsae River trade, but our ports are bustling, too. We've got ships coming and going day and night.|Daggerfall's noble houses are always scrabbling for a bit of King Gothryd's favor.|The Knights of the Dragon keep the peace in Daggerfall. They make sure that nobody steps out of line and that King Gothryd's word is law.|We're the victors of the War of Betony, no doubt about it. Daggerfall doesn't back down from a fight.|Daggerfall recently defeated Sentinel in the War of Betony, a war in which two kings killed each other over a fishing village.|Since King Gothryd took the throne, Daggerfall has only grown in power. |Kynareth watches over Daggerfall, bless Her. Her temples are everywhere. You should visit the grand one in the capital.|Kynareth is the patron goddess of Daggerfall. She keeps our sailors safe and our skies clear.|Kynareth's our goddess, looking out for us on the sea and in the sky, making sure our traders can do their business.|Daggerfall is one of the most powerful kingdoms in High Rock. We're known for our deep harbors and deep pockets. Plenty busy with traders and adventurers coming through.|Under King Gothryd's rule, Daggerfall has never been stronger or more feared.|According to tradition here in Daggerfall, the Day of the Dead is the one day the veil between worlds is thinnest, and the spirits of the dead walk among us to settle old scores.|Daggerfall's streets are filthy and our nobles' hands are filthier. Yet it's this cunning that's grown our city from a mere coastal town to a kingdom of renown.|Our market's heaving with goods from all corners, making Daggerfall a trader's paradise. If it exists, you can buy it here.|We might get dirty looks from the smaller kingdoms, but let 'em talk. Daggerfall's got the muscle and the splendor they wish they had.|Daggerfall is one of the most important cities in High Rock, bustling with traders from across Tamriel. A major port, always busy, always something going on.|Daggerfall is a tough city. Everyone knows everyone, and your reputation matters. You've got to keep your wits about you, especially with all the nobles and their power games.|Daggerfall's roots run deep, back to when we were a little fishing town. Now look at us. A kingdom to reckon with.|King Gothryd and Queen Aubk-i hold court here, and it's all gossip and backstabbing.|Our court's always bustling, with King Gothryd and Queen Aubk-i holding sway over a nest of vipers and silk.|I hear even the servants conspire against each other in Daggerfall's royal court.|You're either in Daggerfall, living the life, or you're outside looking in.|Looking for trouble or intrigue? Daggerfall's where you'll find it.	-|the Knights of the Dragon|Wayrest|King Gothryd|the Knights of the Dragon,King Gothrd|the War of Betony|Sentinel,the War of Betony|King Gothryd|Kynareth|Kynareth|Kynareth|High Rock|King Gothryd|the Day of the Dead|-|-|-|High Rock|-|-|King Gothryd,Queen Aubk-i|King Gothryd,Queen Aubk-i|-|-|-|	Current MapID	==	1291010263	Faction Social Group	==	1|4			
	Daggerfall	Daggerfall is one of the largest and most influential kingdoms in the Iliac Bay, along with Wayrest and Sentinel. Of the three, we are best known for our chivalrous traditions and military strength.|Daggerfall is renowned for its military might. The Knights of the Dragon, the kingdom's order of knights, stand ever ready to defend the realm from threats both within and without.|Daggerfall may not dominate the Bjoulsae River trade like Wayrest, but it's still a major trading hub in western High Rock. Our ports are crowded with ships from across Tamriel.|Daggerfall is home to many noble Breton houses, each vying for influence, power, and the favor of King Gothryd.|Daggerfall is guarded by the Knights of the Dragon, an order dedicated to the protection of the royal family and the enforcement of their decrees throughout the kingdom.|Daggerfall always wins, as proven yet again in the War of Betony.|Daggerfall recently prevailed over Sentinel in the War of Betony, a war in which two kings killed each other over a fishing village.|Since King Gothryd took the throne, Daggerfall has only grown in power. His heroism during the War of Betony cemented our status as a formidable power.|Daggerfall is under the protection of Kynareth, our patron goddess. You'll find her temples all around, especially the great temple in the capital city.|Daggerfall is dedicated to Kynareth, the goddess of the skies and the winds. Her blessings protect our sailors.|Daggerfall's patron goddess is Kynareth. She is revered here for her dominion over the elements of air and sea, vital for a kingdom thriving on maritime trade.|Daggerfall is one of the most powerful kingdoms in High Rock. It's known for its deep harbors and deep pockets. Plenty busy with traders and adventurers coming through.|Under King Gothryd's rule, Daggerfall has never been stronger or more feared.|Daggerfall's Day of the Dead is a peculiar holiday. Our traditions claim it's the one day the veil between worlds is thinnest, and the spirits of the dead walk among us to settle old scores.|Daggerfall's streets are filthy and our nobles' hands are filthier. Yet it's this cunning that's grown our city from a mere coastal town to a kingdom of renown.|Daggerfall is the hub of trade in the west, rivaling even Wayrest. It's said everything ends up for sale in Daggerfall—if not in the shops, then certainly in the seedier corners of the city.|Daggerfall is the envy of lesser cities. Our rivals may whisper of decay and overreach, but they simply cannot match the grandeur and might of Daggerfall. Let them talk; we prefer to act.|Daggerfall is one of the most important cities in High Rock, bustling with traders from across Tamriel. A major port, always busy, always something going on.|Daggerfall is a tough city. Everyone knows everyone, and your reputation matters. You've got to keep your wits about you, especially with all the nobles and their power games.|Daggerfall is known for its rich history, which can be traced back over a thousand years. The city has grown from a humble fishing village to a powerful kingdom.|King Gothryd and Queen Aubk-i presides over the court of Daggerfall, a court known for its elegance and cunning. Nobles from across the land vie for favor within our palace halls.|Daggerfall's court, presided over by King Gothryd and Queen Aubk-i, is a bustling center of power and diplomacy.|Everybody in the court of Daggerfall wins or loses by Gothryd's favor. You need a keen eye to follow who's up and who's down.|King Gothryd's Daggerfall is like a grand ball. Everyone is dancing, some out of joy, others because they dare not stop.|Anyone who lives outside of Daggerfall is a fool, apparently. And anyone who lives in Daggerfall is also a fool.|You want snobbery, treachery, and corruption? No place better than Daggerfall to find them.	Wayrest,Sentinel|the Knights of the Dragon|Wayrest,High Rock|Breton,King Gothryd|the Knights of the Dragon|the War of Betony|Sentinel,the War of Betony|King Gothryd,the War of Betony|Kynareth|Kynareth|Kynareth|High Rock|King Gothryd|the Day of the Dead|-|Wayrest|-|High Rock|-|-|King Gothryd,Queen Aubk-i|King Gothryd,Queen Aubk-i|King Gothryd|King Gothryd|-|-|	Current MapID	==	1291010263						
	Daggerfall	Daggerfall is one of the largest and most influential kingdoms in the Iliac Bay, along with Wayrest and Sentinel. Of the three, we are best known for our chivalrous traditions and military strength.|Daggerfall is renowned for its military might. The Knights of the Dragon, the kingdom's order of knights, stand ever ready to defend the realm from threats both within and without.|Daggerfall may not dominate the Bjoulsae River trade like Wayrest, but it's still a major trading hub in western High Rock. Our ports are crowded with ships from across Tamriel.|Daggerfall is home to many noble Breton houses, each vying for influence, power, and the favor of King Gothryd.|Daggerfall is guarded by the Knights of the Dragon, an order dedicated to the protection of the royal family and the enforcement of their decrees throughout the kingdom.|Daggerfall always wins, as proven yet again in the War of Betony.|Daggerfall recently prevailed over Sentinel in the War of Betony, a war in which two kings killed each other over a fishing village.|Since King Gothryd took the throne, Daggerfall has only grown in power. His heroism during the War of Betony cemented our status as a formidable power.|Daggerfall is under the protection of Kynareth, our patron goddess. You'll find her temples all around, especially the great temple in the capital city.|Daggerfall is dedicated to Kynareth, the goddess of the skies and the winds. Her blessings protect our sailors.|Daggerfall's patron goddess is Kynareth. She is revered here for her dominion over the elements of air and sea, vital for a kingdom thriving on maritime trade.|Daggerfall is one of the most powerful kingdoms in High Rock. It's known for its deep harbors and deep pockets. Plenty busy with traders and adventurers coming through.|Under King Gothryd's rule, Daggerfall has never been stronger or more feared.|Daggerfall's Day of the Dead is a peculiar holiday. Our traditions claim it's the one day the veil between worlds is thinnest, and the spirits of the dead walk among us to settle old scores.	Wayrest,Sentinel|the Knights of the Dragon|Wayrest,High Rock|Breton,King Gothryd|the Knights of the Dragon|the War of Betony|Sentinel,the War of Betony|King Gothryd,the War of Betony|Kynareth|Kynareth|Kynareth|High Rock|King Gothryd|the Day of the Dead	Current Region Name	==	Daggerfall						
	King Gothryd	The proper form of address is “Your Majesty,” peasant.		NPC Name	==	King Gothryd	NPC NoLore	==	3			
	King Gothryd	King Gothryd is a proper king, I say. A hero on the battlefield and a dashing figure in the court.|King Gothryd is a valiant fighter, but he plots as well as he fights.|Some say King Gothryd would have done anything to get the crown during the War of Betony. Whether there's truth to that, I can't say.|Gothryd stepped up to be king the moment his father King Lysandus took an arrow at the Battle of Cryngaine Field.|Gothryd became king right on the battlefield, just after his father's mysterious death. Convenient, isn't it?|King Gothryd slew King Camaron of Sentinel in single combat and took his daughter Aubk-i to bride. Now that's a king for you!|King Gothryd married Aubk-i of Sentinel to put that whole War of Betony mess behind us.|King Gothryd's trying to step out from Lysandus' shadow. But it's a long shadow, stretching even past the grave.|In the taverns, they toast to King Gothryd, but in the shadows, they say he's got ice where his heart should be.|King Gothryd rules with the same iron will his old man did.	-|-|the War of Betony|the War of Betony,King Lysandus|-|Sentinel,Queen Aubk-i|Queen Aubk-i,Sentinel|King Lysandus|-|-	Current MapID	==	1291010263	Faction Social Group	==	1|4			
	King Gothryd	King Gothryd is a proper king, I say. A hero on the battlefield and a dashing figure in the court.|King Gothryd is as cunning as they come. He plots as well as he fights, and not always for the good of his subjects.|I've heard whispers of King Gothryd's ambition, how it might have driven him to ensure his rise during the War of Betony by any means necessary.|Gothryd became king during the War of Betony and lead Daggerfall to victory after the death of his father King Lysandus in the thick of battle.| Gothryd became king right on the battlefield, just after his father's mysterious death. Convenient, isn't it?|King Gothryd slew King Camaron of Sentinel in single combat and took his daughter Aubk-i to bride! Now that's a king for you!|When King Gothryd married Aubk-i, he tied our kingdom with Sentinel. Whether that's a knot or a noose, time will tell.|King Gothryd, bless him, is trying so hard to outshine his father's specter. But it's tough competing with a ghost, especially one as stubborn as Lysandus.|Ask about King Gothryd in the taverns, and you'll hear he's as bold as his father. Ask in the shadows, and you'll hear he's as cold as his father's grave.|King Gothryd is a true son of Daggerfall. He has always been a decisive leader, and his actions have always echoed the courage and wisdom his father Lysandus was known for.	-|-|the War of Betony|the War of Betony,King Lysandus|-|Sentinel,Queen Aubk-i|Queen Aubk-i,Sentinel|King Lysandus|-|King Lysandus	Current MapID	==	1291010263						
	King Gothryd	Are ya soft in the head, %ra? Gothryd's the king of Daggerfall.|Gothryd's the king of Daggerfall, %ra. He lives in a big castle in the capital city.|He's the king. We pay him taxes, he defends the kingdom.|Gothryd, huh? Only seen him on the coins.		Current Region Name	==	Daggerfall						
	Queen Aubk-i	She is my darling and doting wife, and the queen of Daggerfall. Speak to her respectfully or lose your tongue.	Sentinel	NPC Name	==	King Gothryd	NPC NoLore	==	3			
	Queen Aubk-i	Gothryd wed Queen Aubk-i of Sentinel after slaying her father on the battlefield. That might have brought peace between our kingdoms but I wonder about their wedding bed.|Aubk-i's stuck here, playing queen for Daggerfall, but you gotta wonder if her heart's still with Sentinel.|People are always guessing about Aubk-i's true feeling. Is she Daggerfall's queen or still pining for Sentinel's sands?|Aubk-i's a Sentinel princess turned our queen when Gothryd offed her dad. That's politics for you.|Tales go round that Aubk-i's heart never left Sentinel, even if she's wearing Daggerfall's crown now.	Sentinel,King Gothryd|Sentinel|King Gothryd|Sentinel,King Gothryd,the Battle of Cryngaine Field|King Gothryd,the War of Betony,Sentinel	Current MapID	==	1291010263	Faction Social Group	==	1|4			
	Queen Aubk-i	Queen Aubk-i grew up a princess in the rival kingdom of Sentinel. Her marriage to King Gothryd was part of the peace treaty to end the War of Betony, after her father was slain by Gothryd's own hand.|Our Queen Aubk-i is caught between two rival kingdoms; she is from Sentinel but must serve Daggerfall.|Many wonder about Queen Aubk-i's true feelings towards her husband Gothryd and her new home here in Daggerfall.|Queen Aubk-i is the daughter of the late King Camaron and Queen Akorithi of Sentinel. King Gothryd won her for a bride after slaying her father at the Battle of Cryngaine Field.|Queen Aubk-i's marriage to King Gothryd may have ended the War of Betony, but many here suspect her loyalties still lie with Sentinel.	Sentinel,King Gothryd,the War of Betony|Sentinel|King Gothryd|Sentinel,King Gothryd,the Battle of Cryngaine Field|King Gothryd,the War of Betony,Sentinel	Current MapID	==	1291010263						
	Queen Aubk-i	You should ask about the big lords in the big city.|We don't see anyone from the court around these parts.|I've never met her.		Current Region Name	==	Daggerfall						
	King Lysandus	I do so miss my dearly departed father. The living version of him, that is. The dead version has been somewhat more... bothersome.		NPC Name	==	King Gothryd	NPC NoLore	==	3			
	King Lysandus	King Lysandus wanted to end the War of Betony nice and tidy-like. Some say that's why he got an arrow in the throat.|You say Lysandus' name too loud, you might stir his ghost. Rumors are, his own kin might've done him in.|People talk about Lysandus' ghost wanting revenge. Makes you wonder who'd be on that ghostly hit list, doesn't it?|The official story is that King Lysandus got done in by the fog. But some think it was treachery, not mist, that ended him.|Lysandus was the real deal, a true king.|An arrow got King Lysandus right when it mattered. But Gothryd, his boy, he made sure we didn't lose the war his father started.|All the bards sing about Lysandus' bravery in the War of Betony.|King Lysandus and Queen Mynisera were loyal to the Emperor. Now, some say Gothryd's looking to play a different game.	-|King Gothryd,Queen Mynisera|-|-|-|King Gothryd|-|Queen Mynisera,King Gothryd	Current MapID	==	1291010263	Faction Social Group	==	1|4			
	King Lysandus	King Lysandus wanted to end the War of Betony in a peace without victory -- and I hear that is why they killed him.|Daggerfall is haunted by King Lysandus' spirit, howling for vengeance against his murderers. Some whisper that his son King Gothryd or his widowed Queen Mynisera might have orchestrated it all. Such talk is dangerous.|They say the spirit of Lysandus cries out for vengeance against those who betrayed him.|Ah, King Lysandus, slain in the fog of war—or was it the fog of treachery? His demise at the Battle of Cryngaine Field still makes for popular tavern talk.|Lysandus, oh, he was a king as kings should be! He led Daggerfall to glory during his time. A curse upon whoever betrayed him.|King Lysandus met a tragic end at the Battle of Cryngaine Field when an arrow felled him. But Prince Gothryd rallied our soldiers and won the war his father started.|King Lysandus' valor in the War of Betony is sung by every bard in Daggerfall.|King Lysandus and his queen, Mynisera, were always loyal to Emperor Uriel Septim VII. It's said their son Gothryd has other ideas.	-|King Gothryd,Queen Mynisera|-|the Battle of Cryngaine Field|-|the Battle of Cryngaine Field,King Gothryd|-|Queen Mynisera,Uriel Septim VII,King Gothryd	Current MapID	==	1291010263						
	King Lysandus	The old king, innit? I heard he haunts the streets of Daggerfall at night.|I once saw King Lysandus on the road to Burgwall. Had a beard, he did.|One king looks much like another in these parts.		Current Region Name	==	Daggerfall						
	Queen Mynisera	My mother rarely leaves her chambers. I do not imagine she would care to speak with you.		NPC Name	==	King Gothryd	NPC NoLore	==	3			
	Queen Mynisera	Mynisera, the old queen, she's still around, making sure her boy Gothryd doesn't slip up.|Gothryd's mum, Mynisera? She's got the whole widow queen act down pat, but don't think she's not pulling strings.|Mynisera's got her ways in court, teaching young Gothryd how to rule. Mother knows best, I suppose.|Court talk says the old queen Mynisera and Lord Bridwell are cozy, but that's just talk, right? Right?|Some say Queen Mynisera's got the Emperor's ear. Makes you wonder what she whispers to him.|Queen Mynisera, she's like a shadow at court. Her husband's gone, her son's king, but she's still there.	King Lysandus,King Gothryd|King Gothryd,King Lysandus|King Gothryd|Lord Bridwell||King Gothryd,King Lysandus	Current MapID	==	1291010263	Faction Social Group	==	1|4			
	Queen Mynisera	Mynisera is the Dowager Queen of Daggerfall. She served as queen during her husband King Lysandus's reign and now as the mother of the current king, Gothryd.|Mynisera is the mother of King Gothryd and widow of the late King Lysandus.|Mynisera, the Dowager Queen of Daggerfall, still holds much influence in court, guiding her son Gothryd with the wisdom only a mother—and a former queen—can wield.|Mynisera's relationship with Lord Bridwell has been the subject of hushed gossip among the courtiers. Some say their bond was more than mere political alliance.|They say that Mynisera, the Dowager Queen, has the ear of Emperor Uriel Septim VII himself.|King Gothryd's mother, the Dowager Queen Mynisera, still lingers in the court like a shadow. Sometimes it's hard to tell which is the ghost, her or Lysandus.	King Lysandus,King Gothryd|King Gothryd,King Lysandus|King Gothryd|Lord Bridwell|Uriel Septim VII|King Gothryd,King Lysandus	Current MapID	==	1291010263						
	Queen Mynisera	You should ask about the big lords in the big city.|We don't see anyone from the court around these parts.|I've never met her.		Current Region Name	==	Daggerfall						
	Lord Bridwell	Ah, you are looking for Lord Bridwell? That’s him over to your left. He often has need of brave men and women who would serve Daggerfall and their own pockets.		NPC Name	==	King Gothryd	NPC NoLore	==	3			
